Tweet Id,Text,Name,Screen Name,Created At,Favorites,Retweets,Language,Client,Tweet Type,Media Type,URLs,Hashtags,Mentions
907755734326267904,Only ONE HOUR until the polls close! You still have time to make your voice heard. https://t.co/W5MBDF4ZH0 https://t.co/OC0VwsHtQX,Bill de Blasio,BilldeBlasio,Wed Sep 13 00:00:07 +0000 2017,22,13,English,"<a href=""https://sproutsocial.com"" rel=""nofollow"">Sprout Social</a>",Tweet,Photo,1,0,0
907768294693851136,Polls close in ten minutes. Don’t wake up tomorrow regretting not casting your vote.,Bill de Blasio,BilldeBlasio,Wed Sep 13 00:50:01 +0000 2017,58,22,English,"<a href=""https://sproutsocial.com"" rel=""nofollow"">Sprout Social</a>",Tweet,,0,0,0
907781551240499206,"Thank you, NYC! Next up, the general election on November 7. Let’s continue to make this your city.",Bill de Blasio,BilldeBlasio,Wed Sep 13 01:42:42 +0000 2017,291,69,English,"<a href=""https://sproutsocial.com"" rel=""nofollow"">Sprout Social</a>",Tweet,,0,0,0
907792396297162754,"My friends, it is so wonderful to be here to celebrate a resounding victory tonight. Every one of you made a difference. #YOURCity",Bill de Blasio,BilldeBlasio,Wed Sep 13 02:25:47 +0000 2017,88,23,English,"<a href=""https://sproutsocial.com"" rel=""nofollow"">Sprout Social</a>",Tweet,,0,1,0
907792954185670658,I do not accept the status quo in this city. We have more to do. I am not going to stop until we build that fairer city — for everyone.,Bill de Blasio,BilldeBlasio,Wed Sep 13 02:28:00 +0000 2017,74,20,English,"<a href=""http://twitter.com"" rel=""nofollow"">Twitter Web Client</a>",Tweet,,0,0,0
907793561818730496,You know it's your city when your child gets Pre-K for free and when there is a rent freeze for over 2M New Yorkers. #YOURCity,Bill de Blasio,BilldeBlasio,Wed Sep 13 02:30:25 +0000 2017,33,8,English,"<a href=""http://twitter.com"" rel=""nofollow"">Twitter Web Client</a>",Tweet,,0,1,0
907793902509404160,"We have a chance to make bigger changes, to create more fairness in NYC. That’s what we’re going to be talking about these next 2 months",Bill de Blasio,BilldeBlasio,Wed Sep 13 02:31:47 +0000 2017,25,10,English,"<a href=""http://twitter.com"" rel=""nofollow"">Twitter Web Client</a>",Tweet,,0,0,0
907794935037952002,Remember our seniors — so many of them are hanging on by a thread. We must enact a millionaire’s tax for them. It is only fair.,Bill de Blasio,BilldeBlasio,Wed Sep 13 02:35:53 +0000 2017,71,21,English,"<a href=""http://twitter.com"" rel=""nofollow"">Twitter Web Client</a>",Tweet,,0,0,0
907795298495365121,Children are now getting a quality education for free. But we have to go further. It’s time for all three-year-olds to have 3-K for All.,Bill de Blasio,BilldeBlasio,Wed Sep 13 02:37:19 +0000 2017,42,18,English,"<a href=""http://twitter.com"" rel=""nofollow"">Twitter Web Client</a>",Tweet,,0,0,0
907795843654266880,Safety and fairness walk hand-in-hand in New York City. #YOURCity,Bill de Blasio,BilldeBlasio,Wed Sep 13 02:39:29 +0000 2017,19,7,English,"<a href=""http://twitter.com"" rel=""nofollow"">Twitter Web Client</a>",Tweet,,0,1,0
907796122239991808,"This is your city, take it into your hands and shape your future. Change happens because of all of you. #YOURCity",Bill de Blasio,BilldeBlasio,Wed Sep 13 02:40:36 +0000 2017,36,12,English,"<a href=""http://twitter.com"" rel=""nofollow"">Twitter Web Client</a>",Tweet,,0,1,0
907797934678446082,We have a lot more left to do. Tomorrow we get back to work. Thank you. #YOURCity https://t.co/M1BhY6PgFG,Bill de Blasio,BilldeBlasio,Wed Sep 13 02:47:48 +0000 2017,64,28,English,"<a href=""http://twitter.com"" rel=""nofollow"">Twitter Web Client</a>",Tweet,Photo,0,1,0
908077135931346944,"Yesterday proved that New Yorkers want to make our city more fair and affordable for everyone. 
https://t.co/nQz7pCkJUs",Bill de Blasio,BilldeBlasio,Wed Sep 13 21:17:15 +0000 2017,53,12,English,"<a href=""https://sproutsocial.com"" rel=""nofollow"">Sprout Social</a>",Tweet,,1,0,0
908100490747154432,My optimism about the future of the city has grown because I’ve seen what’s possible. Help us make this #YOURCity:  https://t.co/yH3nIh7hJG,Bill de Blasio,BilldeBlasio,Wed Sep 13 22:50:03 +0000 2017,23,8,English,"<a href=""https://sproutsocial.com"" rel=""nofollow"">Sprout Social</a>",Tweet,,1,1,0
908118147584155649,We cannot accept the status quo. I've seen the ways that we need to still build a fairer city and I'm not going to stop until that’s done. https://t.co/R9sykDw0M3,Bill de Blasio,BilldeBlasio,Thu Sep 14 00:00:13 +0000 2017,27,10,English,"<a href=""https://sproutsocial.com"" rel=""nofollow"">Sprout Social</a>",Tweet,Photo,0,0,0
908378388997578752,"All the people who knocked on doors, made phone calls, and had a house party made a real difference on Tuesday. https://t.co/rDR9Z0gzKH",Bill de Blasio,BilldeBlasio,Thu Sep 14 17:14:19 +0000 2017,38,14,English,"<a href=""https://sproutsocial.com"" rel=""nofollow"">Sprout Social</a>",Tweet,Photo,0,0,0
908413123828305920,"In our city, we respect everyone. Documentation status will never be asked by our police, educators, or by public hospital workers.",Bill de Blasio,BilldeBlasio,Thu Sep 14 19:32:20 +0000 2017,139,49,English,"<a href=""https://sproutsocial.com"" rel=""nofollow"">Sprout Social</a>",Tweet,,0,0,0
908439751375671297,"Last week was the beginning of a new era, with the first classrooms of 3-K free early childhood education that will expand across the city.",Bill de Blasio,BilldeBlasio,Thu Sep 14 21:18:09 +0000 2017,50,6,English,"<a href=""https://sproutsocial.com"" rel=""nofollow"">Sprout Social</a>",Tweet,,0,0,0
908456109630984192,"NYC can't wait for @realDonaldTrump to pull his head out of the sand. We will tackle climate change now.  
https://t.co/2mSjoNLbcl",Bill de Blasio,BilldeBlasio,Thu Sep 14 22:23:09 +0000 2017,58,15,English,"<a href=""https://sproutsocial.com"" rel=""nofollow"">Sprout Social</a>",Tweet,,1,0,1
908726623121428480,"#NYPD closely monitoring incident on London subway moments ago. No direct threats to #NYC, but always remain vigilant/aware of surroundings. https://t.co/xH72sHvgo9",Bill de Blasio,BilldeBlasio,Fri Sep 15 16:18:04 +0000 2017,0,254,English,"<a href=""https://sproutsocial.com"" rel=""nofollow"">Sprout Social</a>",Retweet,Photo,0,2,0
908758212836495360,"It is impossible to ignore the opioid crisis killing New Yorkers all over the city. HealingNYC will help.
https://t.co/SeB6GSyBwL",Bill de Blasio,BilldeBlasio,Fri Sep 15 18:23:36 +0000 2017,17,11,English,"<a href=""https://sproutsocial.com"" rel=""nofollow"">Sprout Social</a>",Tweet,,1,0,0
908774284021125120,"Time isn’t on our side. That’s why NYC is stepping up to ensure 14,500 least efficient buildings dramatically cut greenhouse gas emissions.",Bill de Blasio,BilldeBlasio,Fri Sep 15 19:27:28 +0000 2017,24,7,English,"<a href=""https://sproutsocial.com"" rel=""nofollow"">Sprout Social</a>",Tweet,,0,0,0
908790742759374848,"A millionaires’ tax would provide 800,000 low-income New Yorkers with a 50% fare decrease. Everyone deserves world-class transit.",Bill de Blasio,BilldeBlasio,Fri Sep 15 20:32:52 +0000 2017,117,30,English,"<a href=""https://sproutsocial.com"" rel=""nofollow"">Sprout Social</a>",Tweet,,0,0,0
908814778658951168,"The White House won’t step up, so it’s time for a different set of rules in this city to address climate change.
https://t.co/ik69yPIc28",Bill de Blasio,BilldeBlasio,Fri Sep 15 22:08:22 +0000 2017,60,18,English,"<a href=""https://sproutsocial.com"" rel=""nofollow"">Sprout Social</a>",Tweet,,1,0,0
908839669659467777,"We’re attacking the affordability crisis head on with a new plan to create 100,000 good middle-class jobs that pay at least $50,000.",Bill de Blasio,BilldeBlasio,Fri Sep 15 23:47:17 +0000 2017,47,13,English,"<a href=""https://sproutsocial.com"" rel=""nofollow"">Sprout Social</a>",Tweet,,0,0,0
909073394926223365,"My wife @Chirlane is working to end the stigma and misconceptions around mental illness.
https://t.co/jYwnT2C7EE",Bill de Blasio,BilldeBlasio,Sat Sep 16 15:16:01 +0000 2017,37,12,English,"<a href=""https://sproutsocial.com"" rel=""nofollow"">Sprout Social</a>",Tweet,,1,0,1
909103357754822657,"NYC Dreamers should know that help is on the way. All over the country, more and more people are working to protect you. We’re here for you.",Bill de Blasio,BilldeBlasio,Sat Sep 16 17:15:05 +0000 2017,109,30,English,"<a href=""https://sproutsocial.com"" rel=""nofollow"">Sprout Social</a>",Tweet,,0,0,0
909145637756825600,"We shouldn’t discriminate against anyone who chooses to bravely serve our nation. 
https://t.co/lYmyPoJ4Mu",Bill de Blasio,BilldeBlasio,Sat Sep 16 20:03:05 +0000 2017,57,22,English,"<a href=""https://sproutsocial.com"" rel=""nofollow"">Sprout Social</a>",Tweet,,1,0,0
909439469140480000,"✅ Test scores are up 
✅ Graduation rates are up
✅ We are introducing Advanced Placement and computer science classes for every student https://t.co/wLJHsHrnfu",Bill de Blasio,BilldeBlasio,Sun Sep 17 15:30:40 +0000 2017,64,18,English,"<a href=""https://sproutsocial.com"" rel=""nofollow"">Sprout Social</a>",Tweet,Photo,0,0,0
909500534561886211,"If you wait on Washington to solve your problems, you will be waiting in vain. Here in this City, we have to solve our own problems.",Bill de Blasio,BilldeBlasio,Sun Sep 17 19:33:19 +0000 2017,134,43,English,"<a href=""https://sproutsocial.com"" rel=""nofollow"">Sprout Social</a>",Tweet,,0,0,0
909522720785928194,"It’s too hard to vote in New York. It’s simple, we need reforms: early voting, same day registration &amp; a functioning board of elections.",Bill de Blasio,BilldeBlasio,Sun Sep 17 21:01:29 +0000 2017,801,226,English,"<a href=""https://sproutsocial.com"" rel=""nofollow"">Sprout Social</a>",Tweet,,0,0,0
909558584383541248,"NYC was never meant to be a city of real estate developers, or landlords, or the titans of Wall Street. It’s meant to be a city for everyone",Bill de Blasio,BilldeBlasio,Sun Sep 17 23:23:59 +0000 2017,228,64,English,"<a href=""https://sproutsocial.com"" rel=""nofollow"">Sprout Social</a>",Tweet,,0,0,0
910229636625379328,"While Republicans in Washington debate the science, we’ll be fighting climate change. https://t.co/h2KYGo7k46",Bill de Blasio,BilldeBlasio,Tue Sep 19 19:50:31 +0000 2017,33,11,English,"<a href=""https://sproutsocial.com"" rel=""nofollow"">Sprout Social</a>",Tweet,,1,0,0
910248293040566272,"No matter how much I love this place, no matter how much good I’ve seen, I do not accept the status quo in this town. We’ve got more to do.",Bill de Blasio,BilldeBlasio,Tue Sep 19 21:04:39 +0000 2017,68,21,English,"<a href=""https://sproutsocial.com"" rel=""nofollow"">Sprout Social</a>",Tweet,,0,0,0
910262371355987968,"Once again the GOP is trying to take health care from millions of Americans. Let’s end this now: (202) 224–3121.
https://t.co/G7rX5hj91Y",Bill de Blasio,BilldeBlasio,Tue Sep 19 22:00:35 +0000 2017,49,30,English,"<a href=""https://sproutsocial.com"" rel=""nofollow"">Sprout Social</a>",Tweet,,1,0,0
910524512843661314,"Global warming is not fiction. It is real, it is persistent, it is manmade, and it must be stopped.",Bill de Blasio,BilldeBlasio,Wed Sep 20 15:22:15 +0000 2017,171,45,English,"<a href=""https://sproutsocial.com"" rel=""nofollow"">Sprout Social</a>",Tweet,,0,0,0
910545158759890944,"If the federal government backs away from climate change, the rest of us have to step forward and go even further.
https://t.co/3EOhxAF7pK",Bill de Blasio,BilldeBlasio,Wed Sep 20 16:44:17 +0000 2017,26,11,English,"<a href=""https://sproutsocial.com"" rel=""nofollow"">Sprout Social</a>",Tweet,,1,0,0
910592285472989184,"The building emissions requirement will be the equivalent of taking 900,000 cars off NYC roads in a single year.
https://t.co/mpRMT6zB9K",Bill de Blasio,BilldeBlasio,Wed Sep 20 19:51:33 +0000 2017,21,9,English,"<a href=""https://sproutsocial.com"" rel=""nofollow"">Sprout Social</a>",Tweet,,1,0,0
910606847089897473,L’Shanah Tovah! Wishing all New Yorkers celebrating Rosh Hashanah a sweet and healthy new year.,Bill de Blasio,BilldeBlasio,Wed Sep 20 20:49:25 +0000 2017,65,13,English,"<a href=""https://sproutsocial.com"" rel=""nofollow"">Sprout Social</a>",Tweet,,0,0,0
910651485960073216,"The GOP health care repeal plan would mean cancer patients, people with autism, and pregnant women could be charged more. https://t.co/jOkNOYvCUY",Bill de Blasio,BilldeBlasio,Wed Sep 20 23:46:47 +0000 2017,22,11,English,"<a href=""https://sproutsocial.com"" rel=""nofollow"">Sprout Social</a>",Tweet,,1,0,0
910908034746023936,"Republicans are sending a clear message to Americans with the Graham-Cassidy bill: They don’t value women, children, or seniors.",Bill de Blasio,BilldeBlasio,Thu Sep 21 16:46:13 +0000 2017,241,87,English,"<a href=""https://sproutsocial.com"" rel=""nofollow"">Sprout Social</a>",Tweet,,0,0,0
910930572280782848,"This is the number to call your Senators: (202) 224–3121. Put it on speed dial, memorize it. Lives are at stake if #GrahamCassidy passes.",Bill de Blasio,BilldeBlasio,Thu Sep 21 18:15:47 +0000 2017,53,46,English,"<a href=""https://sproutsocial.com"" rel=""nofollow"">Sprout Social</a>",Tweet,,0,1,0
910956436645187584,"Climate change is an existential threat to our planet and every city has to be a part of the solution. 
https://t.co/9QP5AXgxPb",Bill de Blasio,BilldeBlasio,Thu Sep 21 19:58:33 +0000 2017,36,10,English,"<a href=""https://sproutsocial.com"" rel=""nofollow"">Sprout Social</a>",Tweet,,1,0,0
910990853073719302,"New York City proves that we are a stronger as a city because of our diversity.
https://t.co/EPuJDVcGBb",Bill de Blasio,BilldeBlasio,Thu Sep 21 22:15:19 +0000 2017,49,20,English,"<a href=""https://sproutsocial.com"" rel=""nofollow"">Sprout Social</a>",Tweet,,1,0,0
911023199772606464,"Here in New York City, we do not accept greedy corporations trying to undercut the most basic rights of working people.",Bill de Blasio,BilldeBlasio,Fri Sep 22 00:23:51 +0000 2017,195,91,English,"<a href=""https://sproutsocial.com"" rel=""nofollow"">Sprout Social</a>",Tweet,,0,0,0
911236104807907333,"NYC is here to help. We will be sending personnel to Puerto Rico to help with the recovery efforts. 
https://t.co/XdbifJhxak",Bill de Blasio,BilldeBlasio,Fri Sep 22 14:29:51 +0000 2017,59,22,English,"<a href=""https://sproutsocial.com"" rel=""nofollow"">Sprout Social</a>",Tweet,,1,0,0
911260239978287104,"Under #GrahamCassidy, insurance companies could deny coverage to people with pre-existing conditions. Deny maternity care. Raise costs.",Bill de Blasio,BilldeBlasio,Fri Sep 22 16:05:46 +0000 2017,19,14,English,"<a href=""https://sproutsocial.com"" rel=""nofollow"">Sprout Social</a>",Tweet,,0,1,0
911286226451394562,Electric vehicles are part of the solution to climate change. That’s why we’re committed to installing 50 fast-charging hubs in NYC by 2020.,Bill de Blasio,BilldeBlasio,Fri Sep 22 17:49:01 +0000 2017,40,11,English,"<a href=""https://sproutsocial.com"" rel=""nofollow"">Sprout Social</a>",Tweet,,0,0,0
911319650876653568,"FLONYC @Chirlane McCray announced NYC Unity Project earlier this week to help serve our city’s LGBTQ youth. 
https://t.co/39s5Wo0Psg",Bill de Blasio,BilldeBlasio,Fri Sep 22 20:01:50 +0000 2017,23,7,English,"<a href=""https://sproutsocial.com"" rel=""nofollow"">Sprout Social</a>",Tweet,,1,0,1
911379854586781697,"Speak up. Rise up. The Graham-Cassidy bill will fail, but only if we mobilize right now. Call (202) 224-3121 to connect with your senators.",Bill de Blasio,BilldeBlasio,Sat Sep 23 00:01:04 +0000 2017,105,37,English,"<a href=""https://sproutsocial.com"" rel=""nofollow"">Sprout Social</a>",Tweet,,0,0,0
911625710447529987,"NYC is collecting diapers, baby food, batteries &amp; first aid supplies for Puerto Rico at locations in all 5 boroughs.
https://t.co/PCEmjoaJCH",Bill de Blasio,BilldeBlasio,Sat Sep 23 16:18:01 +0000 2017,79,73,English,"<a href=""https://sproutsocial.com"" rel=""nofollow"">Sprout Social</a>",Tweet,,1,0,0
911658479961722880,"This health care battle isn’t over until September 30 has officially come and gone. 
https://t.co/ozGjanrVLw",Bill de Blasio,BilldeBlasio,Sat Sep 23 18:28:14 +0000 2017,35,15,English,"<a href=""https://sproutsocial.com"" rel=""nofollow"">Sprout Social</a>",Tweet,,1,0,0
911678929957740545,Call and tell Republicans that no one should be forced into bankruptcy because of an accident or unforeseen illness: (202) 224-3121.,Bill de Blasio,BilldeBlasio,Sat Sep 23 19:49:29 +0000 2017,67,30,English,"<a href=""https://sproutsocial.com"" rel=""nofollow"">Sprout Social</a>",Tweet,,0,0,0
911700359277633536,"My message to @realDonaldTrump: Our progress as a city has not been in spite of immigrants, it’s been because of immigrants.",Bill de Blasio,BilldeBlasio,Sat Sep 23 21:14:38 +0000 2017,586,189,English,"<a href=""https://sproutsocial.com"" rel=""nofollow"">Sprout Social</a>",Tweet,,0,0,1
911737557884571648,"It’s simple, really: Nobody deserves to die in this country simply because they cannot afford the health care they need.",Bill de Blasio,BilldeBlasio,Sat Sep 23 23:42:27 +0000 2017,235,77,English,"<a href=""https://sproutsocial.com"" rel=""nofollow"">Sprout Social</a>",Tweet,,0,0,0
911961171053486080,"Honored by @HillaryClinton's kind words. No one has done more to focus America on the needs of all our children.
https://t.co/59BWIxdnse",Bill de Blasio,BilldeBlasio,Sun Sep 24 14:31:01 +0000 2017,111,29,English,"<a href=""https://sproutsocial.com"" rel=""nofollow"">Sprout Social</a>",Tweet,,1,0,1
911980406697791488,"Help send a clear message to Congress that New Yorkers oppose taking away health care from the sick and elderly:
https://t.co/Og6MWJ9m92",Bill de Blasio,BilldeBlasio,Sun Sep 24 15:47:27 +0000 2017,39,13,English,"<a href=""https://sproutsocial.com"" rel=""nofollow"">Sprout Social</a>",Tweet,,1,0,0
912025840086593536,"We must stop Republicans from obliterating Medicaid, ending protections for pre-existing conditions &amp; driving up the cost of insurance.",Bill de Blasio,BilldeBlasio,Sun Sep 24 18:47:59 +0000 2017,80,19,English,"<a href=""https://sproutsocial.com"" rel=""nofollow"">Sprout Social</a>",Tweet,,0,0,0
912051278565527557,"Puerto Rico has been through so much. New York City will be there for the people of Puerto Rico. 
https://t.co/kitMnlFhdj",Bill de Blasio,BilldeBlasio,Sun Sep 24 20:29:04 +0000 2017,86,23,English,"<a href=""https://sproutsocial.com"" rel=""nofollow"">Sprout Social</a>",Tweet,,1,0,0
912088690477993989,"For NYC, climate change isn't a myth and it's not something that might happen someday to someone else. It's happening to us right now.",Bill de Blasio,BilldeBlasio,Sun Sep 24 22:57:44 +0000 2017,129,40,English,"<a href=""https://sproutsocial.com"" rel=""nofollow"">Sprout Social</a>",Tweet,,0,0,0
912379758868123648,"Under Trumpcare, many New Yorkers would lose their health care and people with pre-existing conditions would be at risk. Despicable.",Bill de Blasio,BilldeBlasio,Mon Sep 25 18:14:20 +0000 2017,46,23,English,"<a href=""https://sproutsocial.com"" rel=""nofollow"">Sprout Social</a>",Tweet,,0,0,0
912421078856863745,".@realDonaldTrump &amp; his administration are trying to restrict access to the ballot box, but @ACLU is here to help. 
https://t.co/8jAeUUQQUH",Bill de Blasio,BilldeBlasio,Mon Sep 25 20:58:31 +0000 2017,166,90,English,"<a href=""https://sproutsocial.com"" rel=""nofollow"">Sprout Social</a>",Tweet,,1,0,2
912450958231326724,"Here’s what NYC is collecting for Puerto Rico: 
→Batteries
→Baby food
→Diapers
→First Aid supplies
→Feminine hygiene products https://t.co/qDFAezIisa",Bill de Blasio,BilldeBlasio,Mon Sep 25 22:57:15 +0000 2017,155,82,English,"<a href=""https://sproutsocial.com"" rel=""nofollow"">Sprout Social</a>",Tweet,,1,0,0
912481147036323840,"We have to fight all of the things that hold some New Yorkers back, including having a decent wage and paid sick leave for their family.",Bill de Blasio,BilldeBlasio,Tue Sep 26 00:57:13 +0000 2017,48,15,English,"<a href=""https://sproutsocial.com"" rel=""nofollow"">Sprout Social</a>",Tweet,,0,0,0
912689663269380096,Profound thanks to @SteveSchmidtSES for demanding R leaders renounce Trump's racism + divisiveness. A brave voice - his party should listen.,Bill de Blasio,BilldeBlasio,Tue Sep 26 14:45:47 +0000 2017,35,9,English,"<a href=""http://www.twitter.com"" rel=""nofollow"">Twitter for BlackBerry</a>",Tweet,,0,0,1
912706404405870592,"A family that registers together, votes together. A family that votes together betters their community! #YOURcity #voterregistrationday https://t.co/UQXBokWiNj",Bill de Blasio,BilldeBlasio,Tue Sep 26 15:52:18 +0000 2017,0,13,English,"<a href=""https://sproutsocial.com"" rel=""nofollow"">Sprout Social</a>",Retweet,Photo,0,2,0
912710303779041280,"Today is #NationalVoterRegistrationDay! If you’ve moved, just turned 18, or haven’t registered yet, click here: https://t.co/yNAR17AZij https://t.co/y2xCy4S1aI",Bill de Blasio,BilldeBlasio,Tue Sep 26 16:07:48 +0000 2017,26,13,English,"<a href=""https://sproutsocial.com"" rel=""nofollow"">Sprout Social</a>",Tweet,Photo,1,1,0
912741943658020864,Team de Blasio will be out in full force getting New Yorkers registered on #NationalVoterRegistrationDay. Join us: https://t.co/s6iSOZew8H,Bill de Blasio,BilldeBlasio,Tue Sep 26 18:13:31 +0000 2017,13,7,English,"<a href=""https://sproutsocial.com"" rel=""nofollow"">Sprout Social</a>",Tweet,,1,1,0
912759615506583554,just registered Gilberto to vote. he's making sure to keep NYC #YOURcity this November #NationalVoterRegistrationDay https://t.co/wF44LtG88R,Bill de Blasio,BilldeBlasio,Tue Sep 26 19:23:45 +0000 2017,0,5,English,"<a href=""https://sproutsocial.com"" rel=""nofollow"">Sprout Social</a>",Retweet,Photo,0,2,0
912780126089351168,Your activism mattered in this fight. But we must stay vigilant. GOP came for health care before and they won't hesitate to do it again. https://t.co/AK1qoNRX1Q,Bill de Blasio,BilldeBlasio,Tue Sep 26 20:45:15 +0000 2017,45,13,English,"<a href=""https://sproutsocial.com"" rel=""nofollow"">Sprout Social</a>",Tweet,,1,0,0
912812511174512641,"It’s time for us to step up for an island that’s done so much for all of us &amp; for people who need us more than ever
https://t.co/amAazHdq9D",Bill de Blasio,BilldeBlasio,Tue Sep 26 22:53:56 +0000 2017,70,43,English,"<a href=""https://sproutsocial.com"" rel=""nofollow"">Sprout Social</a>",Tweet,,1,0,0
913460169379602432,"Limited electricity. Impassable roads. Basic supplies are unavailable. We owe it to Puerto Rico to help out. 
https://t.co/u5Be7UsWkS",Bill de Blasio,BilldeBlasio,Thu Sep 28 17:47:30 +0000 2017,25,11,English,"<a href=""https://sproutsocial.com"" rel=""nofollow"">Sprout Social</a>",Tweet,,1,0,0
913481147136434177,"When you invest in a park it changes the whole community. That’s why we’re transforming 11 more NYC parks.
https://t.co/YiM7gkZSUu",Bill de Blasio,BilldeBlasio,Thu Sep 28 19:10:51 +0000 2017,36,10,English,"<a href=""https://sproutsocial.com"" rel=""nofollow"">Sprout Social</a>",Tweet,,1,0,0
913503696599650304,We need to increase the pressure on the White House and on Congress to pass the Dream Act. Call the Capitol switchboard now: (202) 224-3121.,Bill de Blasio,BilldeBlasio,Thu Sep 28 20:40:28 +0000 2017,42,20,English,"<a href=""https://sproutsocial.com"" rel=""nofollow"">Sprout Social</a>",Tweet,,0,0,0
913516516418523136,"Under @realDonaldTrump’s tax plan, poor and middle-class Americans will foot the bill for the wealthiest and top 1%. That’s unconscionable.",Bill de Blasio,BilldeBlasio,Thu Sep 28 21:31:24 +0000 2017,127,60,English,"<a href=""https://sproutsocial.com"" rel=""nofollow"">Sprout Social</a>",Tweet,,0,0,1
913861720514363392,"My message to New York City’s Dreamers: You don’t have to struggle alone. #NYCWell is here for you: 1-888-NYC-WELL. 
https://t.co/XQvtWIjL4G",Bill de Blasio,BilldeBlasio,Fri Sep 29 20:23:07 +0000 2017,16,6,English,"<a href=""https://sproutsocial.com"" rel=""nofollow"">Sprout Social</a>",Tweet,,1,1,0
913878777255559168,"Americans in Puerto Rico don’t know when they’ll have their lives restored. As New Yorkers, we have to be committed for the long haul. https://t.co/t4M9ZMA14w",Bill de Blasio,BilldeBlasio,Fri Sep 29 21:30:54 +0000 2017,85,41,English,"<a href=""https://sproutsocial.com"" rel=""nofollow"">Sprout Social</a>",Tweet,,1,0,0
913894882028261382,"To combat the growing rat infestation in the Upper West Side, we’re introducing a program targeting parks and neighborhood schools. https://t.co/NQU9KPznxe",Bill de Blasio,BilldeBlasio,Fri Sep 29 22:34:53 +0000 2017,14,7,English,"<a href=""https://sproutsocial.com"" rel=""nofollow"">Sprout Social</a>",Tweet,,1,0,0
913910598064275456,"This is #YOURCity, where your child and all their friends get free, quality, full-day pre-K — with 3-K for All on the way.",Bill de Blasio,BilldeBlasio,Fri Sep 29 23:37:20 +0000 2017,32,10,English,"<a href=""https://sproutsocial.com"" rel=""nofollow"">Sprout Social</a>",Tweet,,0,1,0
914165456377909249,"Here’s what NYC is collecting for Puerto Rico: 
→Batteries
→Baby food
→Diapers
→First Aid supplies
→Feminine hygiene products https://t.co/qDFAezIisa",Bill de Blasio,BilldeBlasio,Sat Sep 30 16:30:03 +0000 2017,0,82,English,"<a href=""http://twitter.com"" rel=""nofollow"">Twitter Web Client</a>",Retweet,,1,0,0
914207691123372033,"10% of our city is Puerto Rican, has family in Puerto Rico. We need to be there for them, no matter what the federal government does.",Bill de Blasio,BilldeBlasio,Sat Sep 30 19:17:53 +0000 2017,259,78,English,"<a href=""https://sproutsocial.com"" rel=""nofollow"">Sprout Social</a>",Tweet,,0,0,0
